Vocabulary	Defination	Use	Occurences	Accurates
humour	the quality in something that makes it funny; the ability to laugh at things that are funny; the state of your feelings or mind at a particular time	to be in the best of humours	3	2
hollow	having a hole or empty  inside	a hollow metal cylinder; He won something of a hollow victory when his opponent was forced to withdraw with a serious injury.	3	2
hobby	an activity that you do for pleasure when you are not working	Her hobbies include swimming and gardening.	8	5
hire	to give somebody a job;  to pay money to borrow something for a short time	We hired a car from a local firm.	5	4
hesitate	to be slow to speak or act because you feel uncertain or nervous	he hesitated before replying.	5	4
heel	the back part of the foot below the ankle	She took a potato from the fire and sat back on her heels.	4	3
grant	to agree to give somebody what they ask for, especially formal or legal permission to do something	The court granted him leave to appeal.	5	3
grain	the small hard seeds of food plants such as wheat, rice, etc.; a single seed of such a plant	a few grains of rice	5	4
govern	to legally control a country or its people and be responsible for introducing new laws, organizing public services, etc.	He accused the opposition party of being unfit to govern.	6	5
genres	a particular type or style of literature, art, film or music that you can recognize because of its special features	literary/musical genres	6	5
generous	giving or willing to give freely; given freely	He was generous to his friends and family.	7	3
furniture	objects that can be moved, such as tables, chairs and beds, that are put into a house or an office to make it suitable for living or working in	a piece of furniture	4	3
fur	the soft thick mass of hair that grows on the body of some animals; a piece of clothing, especially a coat or jacket, made of real or artificial fur	a fur coat	7	6
fund	an amount of money that has been saved or has been made available for a particular purpose	the company’s pension fund	5	4
frighten	to make somebody suddenly feel afraid	She doesn't frighten easily (= it is not easy to make her afraid).	4	2
fork	a tool with a handle and three or four sharp points (called prongs), used for picking up and eating food	with a fork Mash the mixture with a fork.	6	5
folk	a friendly way of addressing more than one person; people in general	I am going to visit my folks at the weekend.	8	5
flour	a fine white or brown powder made from grain, especially wheat, and used in cooking for making bread, cakes, etc.	Sift the flour and salt into a bowl.	7	6
fence	a structure made of wood or wire supported with posts that is put between two areas of land as a boundary, or around a garden, field, etc. to keep animals in, or to keep people and animals out	Security guards with dogs patrolled the perimeter fence.	3	2
fellow	used to describe somebody who is the same as you in some way, or in the same situation	Thousands of their fellow countrymen are dead.	8	7
fascinating	extremely interesting and attractive	Her letters offer a fascinating insight into early Victorian family life.	2	1
faith	trust in somebody’s ability or knowledge; trust that somebody/something will do what has been promised	We've lost faith in the government's promises.	4	3
facility	buildings, services, equipment, etc. that are provided for a particular purpose	All rooms have private facilities	2	1
extraordinary	unexpected, surprising or strange; not normal or ordinary; greater or better than usual	What an extraordinary thing to say!	5	4
express	to show or make known a feeling, an opinion, etc. by words, looks or actions; to speak, write or communicate in some other way what you think or feel	Teenagers often have difficulty expressing themselves.	7	6
expose	to show something that is usually hidden;  to tell the true facts about a person or a situation, and show them/it to be dishonest, illegal, etc.	He threatened to expose the racism that existed within the police force.	8	7
exhibition	a collection of things, for example works of art, that are shown to the public	an art exhibition	4	3
ethical	connected with beliefs and principles about what is right and wrong; morally correct or acceptable	it is ethical to do something (Is it ethical to keep animals in zoos?)	6	1
estate	an area of land with a lot of houses or factories of the same type on it; a large area of land, usually in the country, that is owned by one person or family	real-estate	3	2
enthusiasm	a strong feeling of excitement and interest in something and a desire to become involved in it; something that you are very interested in and spend a lot of time doing	I don't mind,’ she said, without much enthusiasm.	3	1
enquiry	an official process to find out the cause of something or to find out information about something	a murder enquiry	5	2
enormous	extremely large	an enormous amount of time	6	5
emphasis	special importance that is given to something	to put/lay/place emphasis on something	3	2
crowd	a particular group of people; a large number of people gathered together in a public place, for example in the streets or at a sports game;	Bob introduced her to some of the usual crowd	3	2
elsewhere	​in, at or to another place or other places	The site contains information not found elsewhere.	6	3
dishonest	​not honest; intending to trick people	She has been dishonest with voters.	5	4
desperate	feeling or showing that you have little hope and are ready to do anything without worrying about danger to yourself or others	The prisoners grew increasingly desperate.	4	3
delight	a feeling of great pleasure; joy;	This guitar is a delight to play.	3	2
deliberate	done on purpose rather than by accident	The speech was a deliberate attempt to embarrass the government.	4	1
decline	to become smaller, fewer, weaker, etc.; to refuse politely to accept or to do something	to decline sharply/significantly/dramatically	3	2
crucial	extremely important, because it will affect other things	Private security cameras can prove crucial in some investigations.	3	1
criterion	a standard or principle by which something is judged, or with the help of which a decision is made	one of the criterion	4	3
cottage	a small house, especially in the count	James lived in a charming country cottage with roses around the door.	4	3
corporate	connected with a large business company	The BBC is a corporate organization.	5	4
convince	to make somebody/yourself believe that something is true	Are the prime minister's assurances enough to convince the public?	8	7
continent	any of the world's main continuous expanses of land	the mainland of Europe as distinct from the British Isles.	8	6
contemporary	belonging to the same time;  belonging to the present time;	He was contemporary with the dramatist Congreve.	7	5
conservative	opposed to great or sudden social change; showing that you prefer traditional styles and values	music which is accessible to an audience with extremely conservative tastes	5	3
consequence	a result of something that has happened, especially an unpleasant result	The child was born deformed in consequence of an injury to the mother.	6	5
conscious	aware of something; noticing something; able to use your senses and mental powers to understand what is happening	She's very conscious of the problems involved.	10	8
conduct	to organize and/or do a particular activity	to conduct a survey/poll/study/review	7	4
concern	to affect somebody/something; to involve somebody/something	Don't interfere in what doesn't concern you.	4	2
concentrate	to give all your attention to something and not think about anything else	I struggled to concentrate on my job because I was worried about my son.	5	4
circumstance	the conditions and facts that are connected with and affect a situation, an event or an action	Police said there were no suspicious circumstances surrounding the boy's death.	5	4
campus	the buildings of a university or college and the land around them	The university has campuses in Cairns and Brisbane.	9	8
campaign	a series of planned activities that are intended to achieve a particular social, commercial or political aim	an anti-smoking campaign	3	1
bond	something that forms a connection between people or groups, such as a feeling of friendship or shared ideas and experiences	the bond that links us	5	4
bacteria	the simplest and smallest forms of life, exist in large numbers in air, water and soil, and also in living and dead creatures and plants, and are often a cause of disease.	Neither chilling nor freezing kills all bacteria.	6	5
awful	used to emphasize something, especially that there is a large amount or too much of something; very bad or unpleasant; that shocks people very much	It's going to cost an awful lot of money.	6	5
assess	to make a judgement about the nature or quality of somebody/something	Accurately assessing environmental impacts is very complex.	12	11
aspect	a particular part or feature of a situation, an idea, a problem, etc.; a way in which it may be considered; the appearance of a place, a situation or a person	The exhibition will focus on various aspects of life and culture in the Middle East.	13	8
ashamed	feeling shame or feeling embarrassed about somebody/something or because of something you have done	She was deeply ashamed of her behaviour at the party.	7	6
artificial	made or produced to copy something natural; not real	artificial lighting/light	7	6
arrest	to make somebody notice something and pay attention to it; the person is taken to a police station and kept there because the police believe they may be guilty of a crime	A local man has since been arrested on suspicion of murder.	7	6
armed	involving the use of weapons; carrying a weapon, especially a gun; knowing something or carrying something that you need in order to help you to perform a task	He was armed with all the facts; an armed robbery	8	7
approval	the feeling that somebody/something is good or acceptable; a positive opinion of somebody/something	Do the plans meet with your approval?	8	7
appropriate	suitable, acceptable or correct for the particular circumstances	Is now an appropriate time to make a speech?	9	8
appeal	a deeply felt request for help or information that is needed immediately, especially one made by a charity or by the police; a quality that makes somebody/something attractive or interesting	He made an emotional appeal to voters.	10	8
apparent	easy to see or understand; that seems to be real or true but may not be	Then, for no apparent reason, the train suddenly stopped.;	6	5
apart	separated by a distance, of space or time;  into pieces; not together; separate or separately	The two houses stood 500 metres apart.	2	1
anxious	feeling worried or nervous	The bus was late and Sue began to get anxious.	5	4
annual	happening or done once every year	an annual meeting/event/report/conference	7	6
annoy	to make somebody slightly angry,  to make somebody uncomfortable or unable to relax	His constant joking was beginning to annoy her.	10	9
anniversary	​a date that is an exact number of years after the date of an important or special event	to celebrate your wedding anniversary	9	8
ankle	enlarge imagethe joint connecting the foot to the leg;	She suffered a serious ankle injury in training.	8	7
aircraft	any vehicle that can fly and carry goods or passengers	The aircraft was flown by a young American pilot.	6	5
aid	money, food, etc. that is sent to help countries in difficult situations	humanitarian/food/medical aid	11	10
agreement	a promise or a contract made with somebody	The agreement (= the document recording the agreement) was signed during a meeting at the UN.	9	8
aggressive	angry, and behaving in a threatening way; ready to attack	He became increasingly aggressive as the evening wore on.	5	4
agenda	a plan of things to be done, or problems to be addressed	In our company, quality is high on the agenda.	3	2
agency	a business or an organization that provides a particular service especially when representing other businesses or organizations	She works for an advertising agency.	10	9
afterwards	at a later time; after an event that has already been mentioned	Afterwards she was sorry for what she'd said.	7	6
afford	"(usually used with can or could, especially in negative sentences and questions)
if you say that you can’t afford to do something, you mean that you should not do it because it will cause problems for you if you do"	We cannot afford any more delays.	10	9
admit	to agree, often unwillingly, that something is true	He admitted all his mistakes.	14	12
admire	to respect somebody for what they have done or to respect their qualities	Actually, I greatly admire and respect him.	10	9
actress	a woman who performs on the stage, on television or in films, especially as a profession	The Oscar-winning actress has taken a break from acting.	12	11
acquire	to gain something by your own efforts, ability or behaviour	She has acquired a good knowledge of English.	16	14
accuse	to say that somebody has done something wrong or is guilty of something	(formal) They stand accused of crimes against humanity.	12	10
accompany	(formal) to travel or go somewhere with somebody/something	He was accompanied on the visit by his wife.	16	4
accommodation	[uncountable] (British English) a place to live, work or stay in	We may have to provide alternative accommodation for you.	21	12
academic	[usually before noun] connected with education, especially studying in schools and universities	She had a brilliant academic career.	14	13
absolute	total and complete	‘You're wrong,’ she said with absolute certainty.	11	10
absent	not in a place because of illness, etc.	He was absent from work for two weeks.	11	10
absence	[uncountable, countable] the fact of somebody being away from a place where they are usually expected to be; the occasion or period of time when somebody is away	in somebody's absence The decision was made in my absence (= while I was not there)	10	9
abroad	in or to a foreign country	to go/travel/live/study abroad	9	7
above	at or to a higher place	Put it on the shelf above.	17	16
about	a little more or less than; a little before or after	It costs about $10	13	12
abortion	[uncountable] the deliberate ending of a pregnancy at an early stage	a woman’s right to abortion	15	14
abolish	abolish something to officially end a law, a system or an institution	This tax should be abolished.	20	19
able	able to do something	We're still able to get visas to come and go from Thailand.	20	19
ability	ability to do something the fact that somebody/something is able to do something	People with the disease may lose their ability to communicate.	17	16
ambassador	an official who lives in a foreign country as the senior representative there of their own country	the British Ambassador to Italy/in Rome	18	16
ambitious	determined to be successful, rich, powerful, etc.	They were very ambitious for their children (= they wanted them to be successful).	21	20
abandon	to leave somebody,especially somebody you are responsible for, with no intention of returning	abandon somebody The baby had been abandoned by its mother.	23	22
